{
  "id": "pal_thomas_owen_house",
  "type": "website",
  "citation": "Papers of Abraham Lincoln, payment concerning Thomas J. V. Owen's Chicago house",
  "date": "accessed 2026-09-01",
  "describes_date": "nineteenth century",
  "locator": "named person or event entry",
  "url": "https://papersofabrahamlincoln.org/documents/D250143",
  "tier": 4,
  "rights_status": "check_required",
  "asset_use": "text_only",
  "verified": true,
  "note": "Reviewed for T-0462. Used only to the degree described in the resident research review; identity candidates remain unasserted."
}
