{
  "id": "resident_research_hobson_pioneer",
  "type": "book",
  "citation": "Our Pioneer Heritage, Jesse Hobson biographical material.",
  "date": "20th-century compilation",
  "describes_date": "1835",
  "url": "https://belnapfamily.org/DUP_OPH_vol02.pdf",
  "tier": 3,
  "verified": true,
  "note": "States Jesse Hobson was living in Cook County, Illinois, in 1835 and married Catherine Daugherty April 6, 1835.",
  "rights_status": "check_required"
}
