{
  "id": "resident_research_pugsley_barrien_vanburen",
  "type": "book",
  "citation": "History of Berrien and Van Buren Counties, Michigan (1880), Paw Paw Township, John K. Pugsley migration narrative.",
  "date": "1880",
  "describes_date": "1835",
  "url": "https://ldsgenealogy.com/MI/books/History-of-Berrien-and-Van-Buren-counties-Michigan-With-biographical-sketches-of-its-prominent-men-and-pioneers-part-126.htm",
  "tier": 3,
  "verified": true,
  "note": "Says John K. Pugsley left near Utica, New York in June 1835, traveled to Chicago, prospected there, then returned to Paw Paw Township and entered land. Retrospective but unusually specific full-name/date/route evidence.",
  "rights_status": "check_required"
}
