{
  "id": "chicago_tribune_1909_09_14_rooms_2001_indiana",
  "type": "newspaper",
  "citation": "Classified advertisement, '2001 Indiana-av.—Large rooms for two; lavatory, steam heat ... excellent meals'. Chicago Daily Tribune, 14 September 1909 (vol. 68 no. 220).",
  "author": "Chicago Daily Tribune",
  "date": "1909-09-14",
  "describes_date": "1909-09-14",
  "repository": "Internet Archive (Chicago Tribune microfilm, pub_chicago-daily-tribune)",
  "url": "https://archive.org/details/per_chicago-daily-tribune_1909-09-14_68_220",
  "locator": "The issue's OCR text (per_chicago-daily-tribune_1909-09-14_68_220), the classified columns; the OCR runs neighbouring advertisements together, so only the words quoted in the note are read from it.",
  "tier": 2,
  "rights_status": "public_domain",
  "rights_note": "A United States newspaper of 1909; public domain.",
  "asset_use": "text_only",
  "verified": true,
  "access_notes": "Found by the Internet Archive's full-text search for the street address and read in the issue's OCR text for T-3013 on 2026-10-23; the page image was not consulted.",
  "note": "Rooms and board at 2001 Indiana Avenue in September 1909: the house still stood, now a boarding house, so the printing works the 1911 sheet draws across 2001-2003 came after.",
  "what_it_supplies": [
    "that 2001 Indiana Avenue was still a house in September 1909"
  ],
  "what_it_does_not_supply": [
    "the building's form, storeys, material or outline",
    "a construction or demolition date"
  ]
}
