{
  "id": "jsp_illinois_statutes_gale_imprint",
  "type": "website",
  "citation": "Joseph Smith Papers bibliography, Public and General Statute Laws of Illinois, Chicago: Stephen F. Gale, 1839",
  "date": "accessed 2026-09-01",
  "describes_date": "1839",
  "locator": "bibliographic note to Illinois statute compilation",
  "url": "https://www.josephsmithpapers.org/paper-summary/mayors-order-to-henry-g-sherwood-8-december-1843/2",
  "tier": 4,
  "rights_status": "check_required",
  "asset_use": "text_only",
  "verified": true,
  "note": "Edited documentary bibliography reviewed for T-0463. It supplies Gale's exact Chicago printing imprint; it is not evidence for a scene-date address."
}
