{
  "id": "mower_history_alanson_vaughan",
  "type": "book",
  "citation": "History of Mower County and biographies of its pioneers, including Alanson B. Vaughan.",
  "date": "nineteenth-century county history",
  "describes_date": "later nineteenth century",
  "locator": "Alanson B. Vaughan and Lansing Township passages",
  "url": "https://archive.org/search?query=%22Alanson+B.+Vaughan%22",
  "tier": 3,
  "rights_status": "public_domain",
  "asset_use": "text_only",
  "verified": true,
  "note": "Exact uncommon-name lead in later Minnesota records. No source bridge to Chicago's 1835 letter list was found, so no migration or household fact is asserted."
}
