{
  "id": "rochester_porter_chappel_marriage",
  "type": "website",
  "citation": "Rochester newspaper marriage notices, Jeremiah Porter and Eliza Chappel",
  "date": "accessed 2026-09-01",
  "describes_date": "nineteenth century",
  "locator": "named person or event entry",
  "url": "https://mcnygenealogy.com/vr/newspaper-marr-deaths-1835a.htm",
  "tier": 4,
  "rights_status": "check_required",
  "asset_use": "text_only",
  "verified": true,
  "note": "Reviewed for T-0462. Used only to the degree described in the resident research review; identity candidates remain unasserted."
}
